artist,retrieved,gender,genre
50 Foot Wave,50 Foot Wave,female,alternative pop
Kids on TV,Kids On TV,female,"electroclash, queercore"
Kate Bush,Kate Bush,female,"art pop, art rock, baroque pop, dance rock, new wave pop, permanent wave, piano rock, singer-songwriter"
CSS,CSS,female,"alternative dance, dance-punk, electroclash, electronica, indietronica, new rave"
LP,LP,female,la pop
Joan Jett,Joan Jett & The Blackhearts,female,"glam punk, rock"
Carole King,Carole King,female,"adult standards, brill building pop, folk, folk rock, mellow gold, quiet storm, rock, singer-songwriter, soft rock, soul"
V V Brown,V V Brown,female,"british soul, metropopolis"
Le Tigre,Le Tigre,female,"alternative dance, dance-punk, electroclash, new rave, queercore, riot grrrl"
Janis Martin,Janis Martin,female,"rhythm and blues, rock-and-roll, rockabilly"
Amanda Palmer,Amanda Palmer,female,"anti-folk, dark cabaret, piano rock, steampunk"
Jen Wood,Jena Woods,female,lds youth
Yoko Ono,Yoko Ono,female,"experimental, experimental pop"
Wild Flag,WILD FLAG,female,riot grrrl
Siouxsie Sioux,Siouxsie and the Banshees,female,"alternative rock, dance rock, dream pop, gothic rock, new romantic, new wave, new wave pop, post-punk, punk, uk post-punk"
Alison Moyet,Alison Moyet,female,"dance rock, new romantic, new wave, new wave pop, soft rock, synthpop"
The Lemonheads,The Lemonheads,female,"alternative pop, alternative rock, boston rock, jangle pop, lilith, pop rock, power pop"
Emily Haines,Emily Haines & The Soft Skeleton,female,indie pop
Sonic Youth,Sonic Youth,female,"alternative rock, art rock, blues rock, dance rock, dream pop, experimental rock, garage rock, indie rock, modern rock, new wave, noise pop, noise rock, post-punk, punk, rock"
Tracy + the Plastics,Tracy + The Plastics,female,"electroclash, olympia wa indie, queercore, riot grrrl"
The Butchies,The Butchies,female,"queercore, riot grrrl"
Ninja,Ninja Sex Party,female,"antiviral pop, comic, otacore"
Jack Off Jill,Jack Off Jill,female,"dark cabaret, riot grrrl, steampunk"
P!nk,P!nk,female,"dance pop, pop, post-teen pop"
Kathleen Hanna,Kathleen Hanna,female,riot grrrl
Brenda Lee,Brenda Lee,female,"adult standards, brill building pop, easy listening, lounge, rockabilly"
Lunachicks,Lunachicks,female,riot grrrl
Sara Quin,Sarah Quintana,female,new orleans indie
Ednita Nazario,Ednita Nazario,female,"latin, latin arena pop, latin pop, puerto rican pop, tropical"
Talking Heads,Talking Heads,female,"art punk, art rock, dance rock, funk rock, new wave, permanent wave, post-punk, rock, zolo"
Gladys Knight,Gladys Knight & The Pips,female,"brill building pop, classic soul, disco, funk, motown, quiet storm, soul, southern soul"
Within Temptation,Within Temptation,female,"dutch metal, gothic metal, gothic symphonic metal, power metal, symphonic metal"
Princess Princess,King Princess,female,"dance pop, electropop, indie pop, nyc pop, pop"
Michelle Branch,Michelle Branch,female,"candy pop, dance pop, lilith, neo mellow, pop rock, post-teen pop"
Edie Brickell,Edie Brickell & New Bohemians,female,"folk, lilith, new wave pop, pop rock"
Sarah Harmer,Sarah Harmer,female,"canadian country, canadian indie, canadian singer-songwriter, deep new americana, ectofolk, folk, kingston on indie, lilith"
Sleeper,Sleepermane,female,lo-fi beats
X,XXXTENTACION,female,"emo rap, miami hip hop"
Le Butcherettes,Le Butcherettes,female,mexican indie
The Hush Sound,The Hush Sound,female,"baroque pop, chicago indie, piano rock"
How To Destroy Angels,How To Destroy Angels,female,"alternative metal, electronic rock, industrial metal, industrial rock"
Cerys Matthews,Cerys Matthews,female,"welsh indie, welsh rock"
The Pretty Reckless,The Pretty Reckless,female,"candy pop, post-teen pop"
Roxette,Roxette,female,"europop, new wave pop, pop rock, swedish pop"
Of Monsters and Men,Of Monsters and Men,female,"folk-pop, indie pop, metropopolis, modern alternative rock, modern rock, pop rock, stomp and holler"
Shona Laing,Shona Laing,female,classic nz pop
Rachel Goswell,Rachel Goswell,female,dream pop
Rickie Lee Jones,Rickie Lee Jones,female,"country rock, folk, folk rock, lilith, mellow gold, new wave pop, roots rock, singer-songwriter"
Natalie Imbruglia,Natalie Imbruglia,female,"dance pop, europop, lilith, new wave pop, pop rock"
Ayumi Hamasaki,Ayumi Hamasaki,female,"eurobeat, j-idol, j-pop, japanese r&b"
Samantha Fish,Samantha Fish,female,"kc indie, modern blues, modern blues rock"
The Fiery Furnaces,The Fiery Furnaces,female,"brooklyn indie, e6fi, noise pop"
The Go! Team,The Go! Team,female,"alternative dance, brighton indie, dance-punk, indie pop, new rave"
Deap Vally,Deap Vally,female,garage rock
Koko Taylor,Koko Taylor,female,"acoustic blues, blues, chicago blues, electric blues, traditional blues"
Crystal Bowersox,Crystal Bowersox,female,idol
Clare Grogan,Clare Grogan,female,scottish new wave
Yeah Yeah Yeahs,Yeah Yeah Yeahs,female,"alternative dance, alternative rock, art pop, dance-punk, garage rock, indie pop, indie rock, modern rock, new rave, rock"
Nina Hagen,Nina Hagen,female,german punk
Wolf Alice,Wolf Alice,female,"art pop, english indie rock, garage rock, indie rock, indietronica, modern alternative rock, modern rock, rock"
The Slits,The Slits,female,"alternative rock, dance rock, dance-punk, experimental, experimental rock, no wave, post-punk, punk, riot grrrl, uk post-punk"
Legal Weapon,Legal Weapon,female,deep hardcore punk
Babble,Babbletron,female,abstract hip hop
Betty Blowtorch,Betty Blowtorch,female,riot grrrl
Lisa Hannigan,Lisa Hannigan,female,"chamber pop, irish singer-songwriter"
Daisy Chainsaw,Daisy Chainsaw,female,riot grrrl
Republica,Republica,female,"candy pop, new wave pop"
Sophie Ellis-Bextor,Sophie Ellis-Bextor,female,"dance pop, disco house, europop, new wave pop, pop rock"
Skunk Anansie,Skunk Anansie,female,"british alternative rock, pop rock"
Kylie Minogue,Kylie Minogue,female,"australian dance, australian pop, dance pop, disco house, electropop, eurodance, europop, new wave pop, pop, pop rock"
St. Vincent,St. Vincent,female,"art pop, chamber pop, electropop, escape room, etherpop, freak folk, indie pop, indie rock, indietronica, metropopolis"
Laurie Anderson,Laurie Anderson,female,"art pop, art rock, bow pop, compositional ambient, experimental, experimental pop, experimental vocal, laboratorio"
Tina Turner,Tina Turner,female,"disco, europop, mellow gold, new wave pop, soft rock"
Cher,Cher,female,"dance pop, hollywood, new wave pop, pop"
Elastica,Elastica,female,"alternative pop, alternative rock, britpop, candy pop"
KT Tunstall,KT Tunstall,female,"lilith, neo mellow, pop rock, scottish singer-songwriter"
Live Skull,Live Skull,female,"no wave, noise punk, noise rock"
Juice Newton,Juice Newton,female,"classic country pop, country dawn, new wave pop, soft rock"
Berlin,Berliner Philharmoniker,female,"classical, classical performance, orchestra"
Octavia Sperati,Octavia Sperati,female,"gothic metal, gothic symphonic metal, norwegian doom metal, norwegian metal, symphonic metal"
The Bellrays,The BellRays,female,"action rock, garage rock, punk blues"
The Blackhearts,Joan Jett & The Blackhearts,female,"glam punk, rock"
Bratmobile,Bratmobile,female,"indie punk, olympia wa indie, queercore, riot grrrl"
Tracy Bonham,Tracy Bonham,female,"alternative pop, boston rock, lilith, pop rock"
Vanessa Carlton,Vanessa Carlton,female,"dance pop, lilith, neo mellow, piano rock, pop rock, post-teen pop"
Hey Monday,Hey Monday,female,"candy pop, neon pop punk, pixie, pop emo, pop punk"
Pixies,Pixies,female,"alternative rock, art rock, boston rock, garage rock, modern rock, noise pop, permanent wave, rock"
The New Pornographers,The New Pornographers,female,"alternative rock, anti-folk, canadian indie, chamber pop, indie folk, indie pop, indie rock, modern power pop, modern rock, noise pop, stomp and holler, vancouver indie"
Bif Naked,Bif Naked,female,"canadian indie, canadian rock, candy pop, lilith"
Eisley,Eisley,female,"christian rock, dreamo, indie pop, piano rock"
Shocking Blue,Shocking Blue,female,"classic rock, folk rock, nederpop, psychedelic rock"
Tom Tom Club,Tom Tom Club,female,"dance rock, new romantic, new wave, no wave, post-punk"
Blake Babies,Blake Babies,female,"alternative pop, boston rock"
Romeo Void,Romeo Void,female,"dance rock, new romantic, new wave, new wave pop"
Erase Errata,Erase Errata,female,"bay area indie, riot grrrl"
Tattle Tale,The Tattle Tales,female,"deep power-pop punk, power-pop punk"
The Bangles,The Bangles,female,"album rock, dance rock, europop, jangle pop, mellow gold, new romantic, new wave, new wave pop, pop rock, rock, soft rock"
Killing Heidi,Killing Heidi,female,"australian alternative rock, australian pop, australian rock"
Sarah McLachlan,Sarah McLachlan,female,"canadian pop, canadian singer-songwriter, ectofolk, folk, lilith, neo mellow, new wave pop, permanent wave, pop rock"
Juanita Stein,Juanita Stein,female,australian indie rock
Chaka Khan,Chaka Khan,female,"dance pop, disco, funk, motown, neo soul, post-disco, quiet storm, soul, urban contemporary"
ZOEgirl,ZOEgirl,female,"christian alternative rock, christian music"
The Runaways,The Runaways,female,"early us punk, protopunk"
Maria Taylor,Maria Taylor,female,alabama indie
The Postal Service,The Postal Service,female,"indie pop, indie rock, indietronica, modern rock, seattle indie"
Eve's Plum,Eve's Plum,female,alternative pop
Pitty,Pitty,female,"baile pop, brazilian rock, hard rock brasileiro, mpb, rock gaucho"
Emilíana Torrini,Emilíana Torrini,female,"electronica, icelandic indie, icelandic pop, trip hop"
Cassadee Pope,Cassadee Pope,female,"contemporary country, country pop, pop emo, post-teen pop, viral pop"
Juli,Julia Michaels,female,"dance pop, electropop, pop, post-teen pop"
The Gits,The Gits,female,"chicano punk, grunge, oi, riot grrrl"
Emily Jane White,Emily Jane White,female,"chamber pop, freak folk, indie folk"
Throwing Muses,Throwing Muses,female,"alternative pop, alternative rock, boston rock, dream pop, rhode island indie, riot grrrl"
The Letter Black,The Letter Black,female,"christian alternative rock, christian rock, pixie, pop emo"
Elkie Brooks,Elkie Brooks,female,"classic uk pop, new wave pop"
Big Trouble,Big Troubles,female,popgaze
Tone Norum,Tone Norum,female,classic swedish pop
Sharon Corr,Sharon Corr,female,bow pop
In This Moment,In This Moment,female,"alternative metal, melodic metalcore, nu metal, post-grunge"
Juliana Hatfield,Juliana Hatfield,female,"alternative pop, alternative rock, boston rock, jangle pop, lilith, permanent wave, power pop"
Rita Lee,Rita Lee,female,"baile pop, bossa nova, brazilian rock, mpb, nova mpb"
K's Choice,K's Choice,female,"alternative pop, belgian rock, dutch rock, lilith"
New Young Pony Club,New Young Pony Club,female,"alternative dance, dance-punk, electroclash, electropop, indietronica, neo-synthpop, new rave"
The Kills,The Kills,female,"alternative dance, alternative rock, dance-punk, garage rock, indie rock, modern blues rock, modern rock, new rave, rock"
Joni Mitchell,Joni Mitchell,female,"canadian folk, canadian singer-songwriter, folk, folk rock, lilith, mellow gold, pop rock, rock, roots rock, singer-songwriter, traditional folk"
Powder,Powderfinger,female,"australian alternative rock, australian indie, australian pop, australian rock, pop rock"
Linda Thompson,Richard & Linda Thompson,female,"british folk, country rock, folk, folk rock, roots rock, traditional folk"
Addison Road,Addison Road,female,"ccm, christian alternative rock, christian music"
Auf der Maur,Melissa Auf der Maur,female,rock quebecois
Ringo Sheena,Sheena Ringo,female,"j-pop, j-rock"
Sister Rosetta Tharpe,Sister Rosetta Tharpe,female,"blues, gospel blues, traditional blues"
Betty Curse,Betty Curse,female,candy pop
Sarah McLeod,Sarah McLeod,female,australian dance
Melora Creager,Melora Creager,female,"cello, dark cabaret, steampunk"
Beth Gibbons,Beth Gibbons,female,"art pop, devon indie, electronica, trip hop"
Heart,The Head and the Heart,female,"folk-pop, indie folk, indie pop, neo mellow, new americana, seattle indie, stomp and holler"
Stereolab,Stereolab,female,"alternative rock, art pop, art rock, chamber pop, chamber psych, dance rock, dance-punk, dream pop, electronica, experimental, experimental pop, experimental rock, freak folk, indie pop, indie rock, indietronica, lo-fi, neo-psychedelic, new wave, noise pop, slow core"
Natalia Jiménez,Natalia Jiménez,female,"latin, latin arena pop, latin pop, spanish pop, spanish pop rock"
Allison Crowe,Allison Crowe,female,lilith
Dido,Dido,female,"dance pop, new wave pop, pop rock"
The Mamas & the Papas,The Mamas & The Papas,female,"brill building pop, bubblegum pop, classic rock, country rock, folk, folk rock, mellow gold, psychedelic rock, rock, soft rock, sunshine pop"
Hope Sandoval & the Warm Inventions,Hope Sandoval and the Warm Inventions,female,"art pop, dream pop, freak folk, melancholia, slow core"
Laura Branigan,Laura Branigan,female,"dance rock, europop, new romantic, new wave pop, soft rock, synthpop"
Holly McNarland,Holly McNarland,female,"canadian indie, lilith"
Terra Naomi,Terra Naomi,female,"candy pop, lilith"
Young Marble Giants,Young Marble Giants,female,"alternative rock, art rock, dance rock, dance-punk, experimental, experimental rock, no wave, post-punk, twee pop, uk post-punk"
Lisa Germano,Lisa Germano,female,"etherpop, melancholia, slow core"
Swing Out Sister,Swing Out Sister,female,"new romantic, new wave pop"
My Life With The Thrill Kill Kult,My Life With The Thrill Kill Kult,female,"ebm, electro-industrial, industrial, industrial metal, industrial rock"
Jessica Bailiff,Jessica Bailiff,female,slow core
Mojave 3,Mojave 3,female,"dream pop, noise pop, slow core"
Izïa,Izïa,female,"french indie pop, french indietronica, french rock, nouvelle chanson francaise"
No Doubt,No Doubt,female,"alternative rock, dance pop, permanent wave, pop rock, post-grunge"
Andrea Echeverri,Andrea Echeverri,female,"latin alternative, rock en espanol"
Sky Ferreira,Sky Ferreira,female,"art pop, candy pop, dance pop, electropop, escape room, indie pop, indietronica, la indie, metropopolis, neo-synthpop, pop"
Chantal Kreviazuk,Chantal Kreviazuk,female,"canadian pop, candy pop, ectofolk, lilith, new wave pop, piano rock, pop rock"
Zola Jesus,Zola Jesus,female,"art pop, chamber psych, experimental pop, grave wave, metropopolis, neo-synthpop, noise pop, witch house"
Şebnem Ferah,Şebnem Ferah,female,"turkish pop, turkish rock"
Cocteau Twins,Cocteau Twins,female,"alternative rock, art pop, art rock, chamber psych, dance rock, dream pop, ethereal wave, melancholia, new wave, new wave pop, noise pop, post-punk, scottish indie, shoegaze, slow core"
Özlem Tekin,Özlem Tekin,female,"karadeniz halk muzigi, turkish pop, turkish rock"
Etta James,Etta James,female,"adult standards, jazz blues, soul, soul blues, torch song, vocal jazz"
Miley Cyrus,Miley Cyrus,female,"dance pop, pop, pop rap, post-teen pop"
Hayley Williams,Hayley Williams,female,indie poptimism
Chi Coltrane,Chi Coltrane,female,nederpop
Eels,Eels,female,"alternative rock, garage rock, melancholia"
Christine McVie,Christine McVie,female,"mellow gold, soft rock, yacht rock"
Immaculate Machine,Immaculate Machine,female,"vancouver indie, victoria bc indie"
Queenadreena,Queenadreena,female,slayer
The Julie Ruin,The Julie Ruin,female,"olympia wa indie, riot grrrl"
Ladyhawke,Ladyhawke,female,"alternative dance, dance-punk, electropop, indietronica, metropopolis, neo-synthpop, new rave"
Christy Hemme,Christy Hemme,female,wrestling
PJ Harvey,PJ Harvey,female,"alternative rock, art pop, art rock, chamber pop, chamber psych, garage rock, indie rock, melancholia, permanent wave, piano rock, rock, singer-songwriter"
Lavender Diamond,Lavender Diamond,female,"etherpop, la indie"
Jen Trynin,Jennifer Trynin,female,"alternative pop, boston rock, lilith"
The Dø,The Doors,female,"acid rock, album rock, classic rock, piano rock, psychedelic rock, rock"
Kaliopi,Kaliopi,female,"eurovision, macedonian pop"
Rachael Yamagata,Rachael Yamagata,female,"acoustic pop, lilith"
The Ronettes,The Ronettes,female,"adult standards, brill building pop, classic girl group, motown"
Jill Sobule,Jill Sobule,female,"ectofolk, folk, lilith"
Grace Slick,Grace Slick,female,psychedelic rock
We Are The In Crowd,We Are The In Crowd,female,"candy pop, neon pop punk, pixie, pop emo, pop punk"
Mary Lou Lord,Mary Lou Lord,female,"alternative pop, boston rock, lilith"
Bat for Lashes,Bat For Lashes,female,"alternative dance, art pop, brighton indie, chamber pop, chamber psych, dream pop, electronica, electropop, etherpop, experimental pop, indie pop, indie rock, indietronica, metropopolis, neo-synthpop, new rave"
Little Annie,Little annie,female,dark cabaret
Orenda Fink,Orenda Fink,female,"alabama indie, omaha indie"
The Muffs,The Muffs,female,"alternative pop, alternative rock, power-pop punk, riot grrrl"
Belinda Carlisle,Belinda Carlisle,female,"dance pop, dance rock, europop, new romantic, new wave pop, pop rock, soft rock"
Lydia Lunch,Lydia Lunch,female,no wave
Adickdid,Adickdid,female,riot grrrl
The Escorts,The Escorts,female,classic soul
Show-Ya,SHOW-YA,female,"j-metal, japanese heavy metal"
Carla Bozulich,Carla Bozulich,female,freak folk
Dub Narcotic Sound System,Dub Narcotic Sound System,female,olympia wa indie
Tracy Chapman,Tracy Chapman,female,"folk, lilith, pop rock, singer-songwriter"
Halestorm,Halestorm,female,"alternative metal, nu metal, post-grunge"
Lacey Sturm,Lacey Sturm,female,"christian rock, pixie, pop emo, slayer"
Florence and the Machine,Florence + The Machine,female,"art pop, baroque pop, pop, uk alternative pop"
The Damned,The Damned,female,"alternative rock, dance rock, garage rock, gothic rock, hardcore punk, new wave, post-punk, pub rock, punk"
Sandra Nasic,Sandra Nasic,female,german alternative rock
Lolita Pop,Lolita Pop,female,"classic swedish pop, swedish post-punk"
Concrete Blonde,Concrete Blonde,female,lilith
Bette Bright,Bette Bright,female,deep new wave
Courtney Barnett,Courtney Barnett,female,"art pop, australian indie, chamber pop, indie pop, indie rock, melbourne indie"
Sleater-Kinney,Sleater-Kinney,female,"alternative pop, alternative rock, anti-folk, art pop, indie pop, indie punk, indie rock, lilith, noise pop, olympia wa indie, riot grrrl"
Tsunami Bomb,Tsunami Bomb,female,"punk, ska punk, skate punk"
Tonight Alive,Tonight Alive,female,"candy pop, neon pop punk, pixie, pop emo, pop punk"
Kelly Clarkson,Kelly Clarkson,female,"dance pop, neo mellow, pop, pop rock, post-teen pop, talent show, urban contemporary"
The Minders,The Minders,female,"baroque pop, e6fi, portland indie"
The Shangri-Las,The Shangri-Las,female,"brill building pop, classic girl group"
Baby Animals,Baby Animals,female,"australian alternative rock, australian rock"
Exene Cervenka,Exene Cervenka,female,cowpunk
Toronto,Toronto Symphony Orchestra,female,orchestra
Mother's Finest,Mother's Finest,female,funk rock
Haim,HAIM,female,"art pop, dance pop, indie pop, indietronica, metropopolis, pop, pop rock, rock"
Lush,Lush Rain Creators,female,environmental
Sandi Thom,Sandi Thom,female,"candy pop, scottish singer-songwriter"
Tift Merritt,Tift Merritt,female,"alternative country, ectofolk, folk, indie folk, lilith, new americana, outlaw country, roots rock, singer-songwriter"
band,Zac Brown Band,female,"contemporary country, country, country road, modern country rock"
Shakespears Sister,Shakespears Sister,female,"candy pop, new wave pop"
Bonnie Tyler,Bonnie Tyler,female,"europop, new wave pop, soft rock"
Katastrophy Wife,Katastrophy Wife,female,riot grrrl
Bette Midler,Bette Midler,female,"adult standards, mellow gold, new wave pop, soft rock"
Lita Ford,Lita Ford,female,"album rock, glam metal, hard rock, rock, sleaze rock"
Skeletal Family,Skeletal Family,female,"dark post-punk, dark wave, deathrock, gothic rock"
A Camp,Alex Campos,female,"latin christian, latin worship, mariachi cristiano"
Art in Manila,Art In Manila,female,omaha indie
Amy Macdonald,Amy Macdonald,female,"pop rock, scottish singer-songwriter"
Regina Spektor,Regina Spektor,female,"chamber pop, indie pop, lilith, piano rock, pop rock"
Sharleen Spiteri,Sharleen Spiteri,female,new wave pop
Heather Nova,Heather Nova,female,"lilith, new wave pop, pop rock"
Emmylou Harris,Emmylou Harris,female,"country rock, folk, folk rock, lilith, melancholia, mellow gold, roots rock, singer-songwriter, traditional folk"
Meg & Dia,Meg & Dia,female,"candy pop, pixie, pop emo"
The Dead Weather,The Dead Weather,female,"alternative rock, blues rock, garage rock, indie rock, modern alternative rock, modern blues rock, modern rock, punk blues, rock"
Tribe 8,Tribe 8,female,"queercore, riot grrrl"
Vanessa Amorosi,Vanessa Amorosi,female,"australian dance, australian pop"
Kim Carnes,Kim Carnes,female,"new wave pop, soft rock"
Saint Etienne,Saint Etienne,female,"art pop, britpop, chamber psych, dream pop, electronica, electropop, new wave pop"
Linda Perry,Linda Perry,female,lilith
Fanny,Fanny Lu,female,"colombian pop, cumbia, ecuadorian pop, latin, latin pop, latin viral pop, pop reggaeton, tropical"
Jenny Lewis,Jenny Lewis,female,"anti-folk, art pop, chamber pop, indie folk, indie pop, indie rock, new americana"
Beth Orton,Beth Orton,female,"chamber pop, folk, folktronica, lilith, new wave pop, pop rock, singer-songwriter"
Royal Trux,Royal Trux,female,"experimental rock, gbvfi, lo-fi, noise rock, post-punk"
Gloria Jones,Gloria Jones,female,"motown, northern soul"
Antigone Rising,Antigone Rising,female,lilith
Katrina and the Waves,Katrina & The Waves,female,new wave pop
Reverie Sound Revue,Reverie Sound Revue,female,calgary indie
Jefferson Airplane,Jefferson Airplane,female,"acid rock, album rock, art rock, blues rock, classic rock, folk rock, psychedelic rock, rock, roots rock"
Pat Benatar,Pat Benatar,female,"album rock, classic rock, dance rock, hard rock, heartland rock, mellow gold, new wave pop, rock, soft rock"
Pauline Black,Pauline Black,female,"ska, ska revival"
Sunflower Bean,Sunflower Bean,female,modern power pop
The Vincent Black Shadow,The Vincent Black Shadow,female,pixie
Morningwood,Morningwood,female,candy pop
Transvision Vamp,Transvision Vamp,female,"candy pop, new wave pop"
Dressy Bessy,Dressy Bessy,female,"e6fi, twee pop"
Linda Ronstadt,Linda Ronstadt,female,"adult standards, country rock, folk, folk rock, heartland rock, lilith, mellow gold, singer-songwriter, soft rock"
Automatic Loveletter,Automatic Loveletter,female,"candy pop, neon pop punk, pixie, pop emo"
Vanessa Paradis,Vanessa Paradis,female,"chanson, french indie pop, french pop, french rock, nouvelle chanson francaise"
Brett Anderson,Brett Anderson,female,britpop
Danielle Dax,Danielle Dax,female,"british experimental, gothic rock"
Silbermond,Silbermond,female,"german pop, german pop rock, german rock"
Susan Tedeschi,Susan Tedeschi,female,"blues rock, country rock, electric blues, modern blues"
Marion Raven,Marion Ravn,female,"candy pop, norwegian pop"
Discount,Discount,female,orgcore
Hey,Hey Violet,female,"dance pop, electropop, indie poptimism, modern rock, pixie, pop, post-teen pop, social media pop"
Martina Topley-Bird,Martina Topley-Bird,female,"electronica, trip hop"
Sheena Easton,Sheena Easton,female,"adult standards, mellow gold, minneapolis sound, new romantic, new wave pop, soft rock"
Bonnie Lou,Bonnie Lou,female,rockabilly
Rose Chronicles,Rose Chronicles,female,vancouver indie
Marnie Stern,Marnie Stern,female,noise rock
Tanita Tikaram,Tanita Tikaram,female,new wave pop
Babes in Toyland,Babes In Toyland ,female,"grunge, minneapolis punk, riot grrrl"
Lesley Gore,Lesley Gore,female,"adult standards, brill building pop, bubblegum pop, classic girl group, folk rock, rock-and-roll"
Stina Nordenstam,Stina Nordenstam,female,"etherpop, melancholia, slow core, swedish indie pop, swedish singer-songwriter"
Liz Phair,Liz Phair,female,"alternative pop, alternative rock, candy pop, folk, lilith, new wave pop, permanent wave, pop rock"
Santi White,Santigold,female,"alternative dance, art pop, electropop, escape room, indie pop, indietronica, new rave"
Texas,Little Texas,female,"country, country road, country rock"
Sharon Den Adel,Sharon Den Adel,female,"gothic metal, gothic symphonic metal, symphonic metal"
The Cranberries,The Cranberries,female,"irish rock, pop rock"
Melissa Ferrick,Melissa Ferrick,female,"ectofolk, folk, lilith, new wave pop"
Lucinda Williams,Lucinda Williams,female,"alternative country, anti-folk, country rock, folk, folk rock, heartland rock, indie folk, lilith, mellow gold, new americana, outlaw country, roots rock, singer-songwriter, traditional folk"
Amy Millan,Amy Millan,female,toronto indie
Christian Death,Christian Death,female,"dark post-punk, dark wave, deathrock, ethereal wave, gothic rock, industrial, industrial rock"
Debbie Gibson,Debbie Gibson,female,"new wave pop, pop rock, soft rock"
Tribe,A Tribe Called Quest,female,"alternative hip hop, conscious hip hop, east coast hip hop, gangster rap, hardcore hip hop, hip hop, jazz rap, queens hip hop, rap"
Jefferson Starship,Jefferson Starship,female,"album rock, art rock, classic rock, folk rock, hard rock, mellow gold, rock, soft rock, symphonic rock"
Alanis Morissette,Alanis Morissette,female,"alternative rock, canadian pop, canadian singer-songwriter, pop rock, singer-songwriter"
'Til Tuesday,'Til Tuesday,female,"boston rock, dance rock, new romantic, new wave, new wave pop"
Olivia,Olivia O'Brien,female,"dance pop, pop, post-teen pop"
The United States of America,The Presidents Of The United States Of America,female,"alternative metal, alternative rock, garage rock, grunge, pop rock, post-grunge, rock"
Miho Hatori,Miho Hatori,female,shibuya-kei
Delerium,Delerium,female,trance
